Taxon,ForewingColor,ColorSymmetrical,HeadPronotumColor,EyeColor,PronotalHump,Range,AbdomenColor
Homalodisca insolita,Entirely brown,Symmetrical,Dark brown with light brown patterning,"Dorsally brown, ventrally pale",Less pronounced,Southeastern,Entirely white/yellow
Homalodisca elongata,Green to white with black lines on veins,Symmetrical | Asymmetrical,White to blue lines with black borders,White to light blue with distinct black stripes,n/a,AZ | TX,"Same color as head, with a dark slash in the center of each segment and a dorsal indentation"
Homalodisca icthyocephala,Mostly transparent with red patterning on the apical half,Asymmetrical,"Brown with few yellow speckles",Yellow with random black markings,Very pronounced,TX,"White, usually restricted to the first few segments, without much black lower down"
Homalodisca liturata,Mostly transparent with red patterning on the apical half,Symmetrical | Asymmetrical,"Yellow to blue lines with black borders",Entirely light blue to green with random black markings | Yellow with random black markings,n/a,CA | NV,"White extends to posterior of abdomen, black is more consistently splotchy lower down"
Homalodisca vitripennis,Mostly transparent with red patterning on the apical half,Asymmetrical,"Brown with many yellow speckles",Yellow with random black markings,Pronounced | Less pronounced,Southeastern | CA | TX,"White extends almost to the posterior abdomen, black is evident, more speckled lower down"
